{
  "schema_id": "researchos-task-extension-v1",
  "core_api_version": "1",
  "id": "method_comparison",
  "version": "1.1.0",
  "enabled": false,
  "available_in": [
    "private",
    "public_starter",
    "personal_vault"
  ],
  "public_safe": true,
  "sensitivity_default": "local_only",
  "documentation": {
    "readme": "docs/plugins/method-comparison/README.md"
  },
  "governance": {
    "schema_id": "researchos-plugin-governance-v1",
    "contract_id": "researchos.contribution.method_comparison",
    "archetype": "task_led",
    "distribution": {
      "variant": "public",
      "parity_policy": "scoped_variant",
      "allowed_divergence_fields": [
        "available_in",
        "public_safe",
        "governance.distribution.variant",
        "governance.data_policy"
      ]
    },
    "lineage": {
      "prototype_id": "researchos_plugin_task_v1",
      "derivation_mode": "native",
      "reuse_policy": "native",
      "source_refs": [],
      "external_runtime_dependency": "none",
      "transformation_summary": "Native task-led example with a reusable method skill and a reproducible ResearchOS read adapter; the host retains execution and admission authority.",
      "current_placement": "plugin",
      "proposed_absorption_target": "none",
      "absorption_gate": "review_required"
    },
    "task_contract": {
      "task_id": "method_comparison",
      "user_job": "Compare user-selected research methods under one explicit question and evidence boundary.",
      "inputs": [
        "Two or more user-selected papers or cards",
        "One explicit decision or comparison question"
      ],
      "outputs": [
        "Comparison dimensions",
        "Evidence-bounded judgment",
        "Unresolved differences",
        "Next action"
      ],
      "invariants": [
        "User-selected materials remain the source authority",
        "No evidence is invented",
        "Durable writeback remains a Review candidate until human confirmation"
      ],
      "confirmation_gates": [
        "Confirm the comparison question before analysis",
        "Confirm before durable writeback or public reuse"
      ],
      "completion_criteria": [
        "All methods are compared under explicit shared dimensions",
        "Each judgment traces to evidence or is marked unresolved",
        "The result mode, validation limit, and next action are reported"
      ],
      "failure_modes": [
        "The comparison question is missing",
        "Source coverage is insufficient",
        "The selected methods are not comparable under the proposed dimensions"
      ],
      "recovery": [
        "Request the missing question or source",
        "Narrow the comparison scope",
        "Return unresolved differences instead of forcing a ranking"
      ],
      "comparison_target": "current_model_without_task_workflow",
      "comparison_status": "planned",
      "expected_deltas": [
        "quality",
        "evidence_boundary",
        "efficiency"
      ],
      "expected_burdens": [
        "context_cost",
        "maintenance_cost"
      ],
      "evidence_refs": [],
      "retention_rule": "Retain the task-led extension only if its bounded workflow is more reliable than an unconstrained current-model answer."
    },
    "effects": {
      "default_effect": "answer",
      "allowed_effects": [
        "read_only",
        "answer",
        "artifact",
        "review_candidate"
      ]
    },
    "data_policy": {
      "default_sensitivity": "inherit_runtime",
      "default_export_policy": "public_safe"
    },
    "composition": {
      "requires": [
        "researchos_core"
      ],
      "provides": [
        "method_comparison"
      ],
      "optional_integrations": [
        "research_asset_navigation"
      ],
      "conflicts_with": []
    },
    "routing": {
      "trigger_intents": [
        "method_comparison",
        "evidence_bounded_comparison"
      ],
      "non_goals": [
        "paper_ranking_without_question",
        "evidence_invention"
      ],
      "handoff_to": [
        {
          "kind": "capability",
          "id": "research_asset_navigation",
          "availability": "if_available"
        },
        {
          "kind": "core_route",
          "id": "review",
          "availability": "required"
        }
      ]
    },
    "admission": {
      "maturity": "instrumented",
      "proof_refs": [
        "evals/test_task_extensions.py",
        "evals/test_method_comparison_example.py"
      ],
      "last_reviewed": "2026-09-11",
      "revalidation_triggers": [
        "task_extension_contract_change",
        "public_variant_change",
        "human_use_evidence"
      ],
      "retirement_condition": "Retire when it no longer demonstrates the smallest safe installable task-extension pattern."
    }
  },
  "authority": {
    "source": "User-selected papers or cards remain the evidence source.",
    "candidate": "The comparison is a candidate judgment until reviewed.",
    "confirmation": "Human confirmation is required before durable writeback or public reuse.",
    "save_target": "Use the existing answer, artifact, or Review flow; this extension owns no storage.",
    "requires_human_confirmation": true,
    "writeback_route": "review",
    "storage_owner": "researchos_core"
  },
  "task": {
    "aliases": [
      "compare_methods"
    ],
    "workspace": "agent",
    "result_modes": [
      "answer",
      "artifact",
      "writeback"
    ],
    "default_result_mode": "answer",
    "budget": "quick/standard/evidence",
    "read": {
      "quick": [
        "docs/plugins/method-comparison/skill-adapter.md"
      ],
      "standard": [
        "docs/plugins/method-comparison/skill-adapter.md",
        "05_workflows/research_management/material-analysis-lifecycle-standard.md",
        "09_templates/workflow-template.md",
        "09_templates/data_contracts/researchos-extension-contract-v1.md"
      ],
      "evidence": [
        "docs/plugins/method-comparison/skill-adapter.md",
        "05_workflows/research_management/material-analysis-lifecycle-standard.md",
        "09_templates/workflow-template.md",
        "09_templates/data_contracts/researchos-extension-contract-v1.md"
      ]
    },
    "locales": {
      "en": {
        "name": "Compare research methods",
        "goal": "Compare selected methods under an explicit research question and evidence boundary.",
        "user_input_hint": "Provide two or more paper/card paths and the decision the comparison should support.",
        "output": "Comparison dimensions + evidence-bounded judgment + unresolved differences + next action",
        "next_steps": [
          "Confirm the comparison question",
          "Attach the smallest relevant source set",
          "Choose answer, artifact, or write-back"
        ]
      },
      "zh-CN": {
        "name": "研究方法对比",
        "goal": "围绕一个明确研究问题，在证据边界内比较用户选定的方法。",
        "user_input_hint": "提供至少两个论文或卡片路径，并说明这次比较要支持什么判断。",
        "output": "比较维度 + 有证据边界的判断 + 未解决差异 + 下一步",
        "next_steps": [
          "确认比较问题",
          "附上最小相关来源集",
          "选择直接回答、生成文件或候选写回"
        ]
      }
    }
  }
}
